{"baseline_model_id":"demo_baseline_mean5","champion_model_id":"demo_model_v1","model_card":"DEMO model card: a synthetic model used to exercise the accuracy page. Units: disposals per player-game.","reports":[{"label":"DEMO prospective 2026","model_id":"demo_model_v1","origin":"prospective","resource":"accuracy/demo_model_v1/2026-prospective.json","season":2026},{"label":"DEMO replay 2026","model_id":"demo_model_v1","origin":"replay","resource":"accuracy/demo_model_v1/2026-replay.json","season":2026}]}
